date,text,section,title
02.04.19 20:47,O ministro Sergio Moro rebateu as críticas à nomeação de Wilson Damazio para o Conselho Nacional de Política Criminal e Penitenciária...,Brasil,Moro rebate críticas a Wilson Damazio
02.04.19 21:15,"Eduardo Carnelós, o advogado de Michel Temer, afirmou em nota que o recebimento da denúncia contra o ex-presidente por Marcelo Bretas ""estava anunciado""...",Brasil,"Recebimento de denúncia por Bretas ‘estava anunciado’, diz advogado de Temer"
02.04.19 21:00,"Alceu Moreira, o presidente da Frente Parlamentar da Agropecuária --que hoje declarou apoio à reforma da Previdência--, reclamou de Flávio Bolsonaro a Joice Hasselmann e Vitor Hugo, líderes do governo no Congresso...",Brasil,"‘Chega, não dá mais’, diz presidente da frente ruralista a líderes do governo"
02.04.19 20:40,"A comissão processante que vai analisar o pedido de impeachment de Marcelo Crivella, com três vereadores, será formada por dois aliados do prefeito do Rio...",Brasil,Aliados de Crivella dominam comissão que analisa seu impeachment
02.04.19 20:20,"Só 11% dos moradores da Venezuela acreditam em Nicolás Maduro quando ele diz que os apagões do país são furto de ""sabotagem""...",Mundo,Só 11% acreditam em tese de Maduro sobre ‘sabotagem’
02.04.19 20:10,"Rodrigo Maia esclareceu há pouco, na Câmara, a declaração de que o modelo de capitalização proposto na reforma da Previdência não será aprovado...",Brasil,Maia defende regime de capitalização “híbrido”
